Character,Description,Lyrics,Dance,Singing,It_Factor,Not_looking_like_a_demon,Fighting,Friendship
Rumi,"The lead singer and main creative force behind Huntr/x, Rumi fights with a sword that she can make magically appear. She also is half demon and is embarrassed about that ",3,4,5,5,-1,5,2
Mira,"The creative director for the visual effects behind Huntr/x, Mira was always a bad girl growing up but now has friends and fights demons with a sharp thing on the end of a stick!",2,5,3,4,4,5,5
Zoey,Zoey is Huntr/x' main lyricist and she fights demons with some knife things she throws. She is from Berkeley California and is very much a people pleaser.,5,2,1,4,4,5,5
Jinu,"Jinu is the lead singer of Saja Boys and also a demon. Long ago he betrayed his family due to Gwi-ma's evil influence, but he is good now.",3,4,3,5,5,4,1
Bobby,Bobby is Huntr/X's manager. He is good at booming venues but not good at realizing that the band he manages is also a demon fighting team.,-1,-4,-1,-2,-4,-4,4